{
  "schemaVersion": 1,
  "release": {
    "id": "wap-1.2.1",
    "title": "WAP 1.2.1 Specification Suite",
    "releaseLabel": "WAP 1.2.1 (June 2000)",
    "authority": "WAP Forum / Open Mobile Alliance",
    "catalogUrl": "https://www.openmobilealliance.org/specifications/affiliates/wap-forum/",
    "legacyReleaseCatalogUrl": "https://www.wapforum.org/what/technical_1_2_1.htm",
    "archiveUrl": "https://www.openmobilealliance.org/tech/affiliates/wap/Technical_June2000-20021106%5B1%5D.zip",
    "archiveOriginalFilename": "Technical_June2000-20021106[1].zip",
    "archivePublishedSnapshot": "2002-11-06",
    "retrievedOn": "2026-07-24",
    "archiveBytes": 7817993,
    "archiveSha256": "382b7991701f99bc88e61c33aca740440044381788ba4b87591242a3a5e11cae",
    "archiveChecksumAlgorithm": "sha256",
    "archiveIntegrity": "unzip-test-passed",
    "memberCount": 97
  },
  "targetPolicy": {
    "compatibilityFloor": "WAP 1.2.1 with WML 1.3",
    "classificationStatus": "preliminary-planning-classification",
    "classificationRule": "The source class describes project planning scope, not an extracted WAP conformance verdict. SCR/CCR and effective-spec analysis may refine it.",
    "strictBehavior": "Core observable mechanics must remain historically compliant. Enhancements must be behavior-preserving or explicitly separated from strict mode."
  },
  "redistribution": {
    "termsUrl": "https://www.openmobilealliance.org/about/policies/use-agreement/",
    "status": "review-required",
    "repositoryPolicy": "metadata-only",
    "archiveCommitted": false,
    "newlyRecoveredMembersCommitted": false,
    "note": "Keep recovered binaries and parsed derivatives outside Git until public-repository redistribution is explicitly approved."
  },
  "associatedAssets": [
    {
      "id": "channel-1.2-dtd",
      "title": "Channel 1.2 Document Type Definition",
      "sourceUrl": "https://www.openmobilealliance.org/tech/dtd/channel12.dtd",
      "relationship": "associated-with-release",
      "targetDisposition": "not-required-by-selected-class-c",
      "retrievedOn": "2026-07-24",
      "retrievalState": "verified-temporary",
      "bytes": 892,
      "sha256": "00baa80d3be6a4558b3115ebb1d6b3a58eea9cfb6bba0fd1f4ad73b993cfc31d",
      "checksumAlgorithm": "sha256",
      "redistributionStatus": "review-required"
    },
    {
      "id": "wml13-dtd",
      "title": "WML 1.3 Document Type Definition",
      "sourceUrl": "https://www.openmobilealliance.org/tech/dtd/wml13.dtd",
      "relationship": "associated-with-release",
      "targetDisposition": "strict-baseline",
      "retrievedOn": "2026-07-24",
      "retrievalState": "verified-temporary",
      "bytes": 9015,
      "sha256": "764fe546974f15b40c1e49a0f3e954219e78f518c53a6d7d3956cab62be72dfb",
      "checksumAlgorithm": "sha256",
      "redistributionStatus": "review-required"
    },
    {
      "id": "pap-1.0-dtd",
      "title": "Push Access Protocol 1.0 Document Type Definition",
      "sourceUrl": "https://www.openmobilealliance.org/tech/dtd/pap_1.0.dtd",
      "relationship": "associated-with-release",
      "targetDisposition": "optional-push-profile",
      "retrievedOn": "2026-07-24",
      "retrievalState": "verified-temporary",
      "bytes": 8080,
      "sha256": "bfcec60e17f07ed87b772004dfe784cda2bd88aaf8f211c4eafc68b1cb7a319a",
      "checksumAlgorithm": "sha256",
      "redistributionStatus": "review-required"
    },
    {
      "id": "service-indication-dtd",
      "title": "Service Indication Document Type Definition",
      "sourceUrl": "https://www.openmobilealliance.org/tech/dtd/si.dtd",
      "relationship": "associated-with-release",
      "targetDisposition": "optional-push-profile",
      "retrievedOn": "2026-07-24",
      "retrievalState": "verified-temporary",
      "bytes": 1676,
      "sha256": "f71e1c657b501a49ba98dde685d29fe2c88107031f01e7d14781a36a669cf50b",
      "checksumAlgorithm": "sha256",
      "redistributionStatus": "review-required"
    },
    {
      "id": "service-loading-dtd",
      "title": "Service Loading Document Type Definition",
      "sourceUrl": "https://www.openmobilealliance.org/tech/dtd/sl.dtd",
      "relationship": "associated-with-release",
      "targetDisposition": "optional-push-profile",
      "retrievedOn": "2026-07-24",
      "retrievalState": "verified-temporary",
      "bytes": 1025,
      "sha256": "8393b66f4f9c30163613b553b765504d3f92dadd1eaca9775265b33d15c4f972",
      "checksumAlgorithm": "sha256",
      "redistributionStatus": "review-required"
    },
    {
      "id": "wta-wml-1.2-dtd",
      "title": "WTA-WML 1.2 Document Type Definition",
      "sourceUrl": "https://www.openmobilealliance.org/tech/dtd/wta-wml12.dtd",
      "relationship": "associated-with-release",
      "targetDisposition": "optional-wta-profile",
      "retrievedOn": "2026-07-24",
      "retrievalState": "verified-temporary",
      "bytes": 539,
      "sha256": "dccd67a26526098adfae881a7826a21be34d69bd66cccd005a265e71a292a84c",
      "checksumAlgorithm": "sha256",
      "redistributionStatus": "review-required"
    }
  ],
  "governingDependencies": [
    {
      "documentId": "WAP-215-ClassConform-20001213-a",
      "title": "WAP June 2000 Class Conformance Requirements",
      "sourceUrl": "https://www.wapforum.org/tech/documents/WAP-215-ClassConform-20001213-a.pdf",
      "catalogUrl": "https://www.wapforum.org/what/technical_1_2_1.htm",
      "technicalFaqUrl": "https://www.wapforum.org/faqs/technicalfaq.htm",
      "originalDownloadRoute": "http://www1.wapforum.org/tech/terms.asp?doc=WAP-215-ClassConform-20001213-a.pdf",
      "relationship": "release-class-conformance-requirements",
      "publicationStatus": "approved",
      "publishedOn": "2000-12-13",
      "retrievedOn": "2026-07-24",
      "retrievalState": "verified-temporary",
      "bytes": 47936,
      "sha256": "af578cd57a7e043b693e0b0dd5ef59b27f8e778e481831ec8737337ee8e44f9d",
      "checksumAlgorithm": "sha256",
      "pageCount": 16,
      "mediaType": "application/pdf",
      "provenanceGrade": "A",
      "cacheRef": "private-research-cache/wap-1.2.1/governing/WAP-215-ClassConform-20001213-a.pdf",
      "textExtraction": {
        "cacheRef": "private-research-cache/wap-1.2.1/governing/WAP-215-ClassConform-20001213-a.txt",
        "bytes": 35121,
        "sha256": "d0b4cb2e7e1cb1340320845655176233f53b817bf29f93b102db6f49c030d00f",
        "checksumAlgorithm": "sha256"
      },
      "localState": "missing",
      "redistributionStatus": "review-required",
      "recoveryReviewedOn": "2026-07-24",
      "recoveryStatus": "Recovered from the live original WAP Forum domain and independently verified by byte size, SHA-256, PDF metadata, page count, document identity, and table extraction.",
      "note": "The catalog-visible filename omits one zero, but its legacy doc parameter, the technical FAQ, the live payload, and the document identity all use 20001213. The binary and parsed text remain outside Git pending redistribution approval."
    },
    {
      "documentId": "WAP-221-CREQ-20010425-a",
      "title": "Specification of WAP Conformance Requirements",
      "sourceUrl": "https://www.openmobilealliance.org/tech/affiliates/wap/WAP-221-CREQ-20010425-a.pdf",
      "relationship": "applies-to-conformance-releases-after-wap-1.1",
      "retrievedOn": "2026-07-24",
      "retrievalState": "verified-temporary",
      "bytes": 38934,
      "sha256": "d8713c9148db06d03365c361350eac8282f6b2f5ea6314ac80d728d57b8ac905",
      "checksumAlgorithm": "sha256",
      "localState": "missing",
      "redistributionStatus": "review-required"
    },
    {
      "documentId": "WAP-273-CertPolicy-20010831-a",
      "title": "WAP Conformance Process and Certification Policy",
      "sourceUrl": "https://www.openmobilealliance.org/tech/affiliates/wap/WAP-273-CertPolicy-20010831-a.pdf",
      "relationship": "applies-to-conformance-releases-after-wap-1.1",
      "retrievedOn": "2026-07-24",
      "retrievalState": "verified-temporary",
      "bytes": 110965,
      "sha256": "61b220887a860b57268dd122075dcaec5435e8fe5d0816a9c4e815b54d342e92",
      "checksumAlgorithm": "sha256",
      "localState": "missing",
      "redistributionStatus": "review-required"
    }
  ],
  "historicalConformanceEvidence": [
    {
      "documentId": "PROTO-ClassConform-19990701",
      "title": "WAP Class Conformance Requirements",
      "publicationStatus": "prototype",
      "baseline": "WAP 1.1",
      "publishedOn": "1999-07-01",
      "sourceUrl": "https://web.archive.org/web/20000309180049id_/http://www.wapforum.org/what/technical/PROTO-ClassConform-19990701.pdf",
      "relationship": "non-normative-class-profile-lineage",
      "retrievedOn": "2026-07-24",
      "retrievalState": "verified-temporary",
      "bytes": 31825,
      "sha256": "8404b0686177616233755ce55cc4859efa8ae66cd6cd414ea2d809794eb478ad",
      "checksumAlgorithm": "sha256",
      "localState": "missing",
      "redistributionStatus": "review-required",
      "note": "Useful for the class-profile mechanism only; it cannot replace approved WAP-215."
    }
  ],
  "summary": {
    "memberCount": 97,
    "bySourceClass": {
      "core-mandatory": 29,
      "core-optional": 7,
      "dependency": 6,
      "historical": 2,
      "profile-optional": 53
    },
    "byLocalState": {
      "canonical-content-differs": 4,
      "canonical-exact": 21,
      "missing": 72
    }
  },
  "members": [
    {
      "documentId": "OMA-WAP-201_003-WTP-SIN",
      "specificationNumber": 201,
      "revision": "003",
      "documentRole": "sin",
      "publicationStatus": "approved",
      "publishedOn": "2002-09-04",
      "family": "wtp",
      "title": "Wireless Transaction Protocol",
      "sourceClass": "core-mandatory",
      "ingestionPriority": 1,
      "filename": "OMA-WAP-201_003-WTP-SIN-20020904-a.PDF",
      "authority": "WAP Forum",
      "archiveMemberPath": "OMA-WAP-201_003-WTP-SIN-20020904-a.PDF",